{
    "$schema": "http://json-schema.org/draft-04/schema#",
    "properties": {
        "buy_price": {
            "maxLength": 7000,
            "minLength": 450,
            "type": [
                "null",
                "number"
            ]
        },
        "clothing_group_id": {
            "maxLength": 4,
            "minLength": 1,
            "type": [
                "string"
            ]
        },
        "color_1": {
            "maxLength": 8,
            "minLength": 3,
            "type": [
                "string"
            ]
        },
        "color_2": {
            "maxLength": 8,
            "minLength": 3,
            "type": [
                "string"
            ]
        },
        "exchange_currency": {
            "maxLength": 14,
            "minLength": 10,
            "type": [
                "null",
                "string"
            ]
        },
        "exchange_price": {
            "maxLength": 900,
            "minLength": 20,
            "type": [
                "null",
                "number"
            ]
        },
        "filename": {
            "maxLength": 38,
            "minLength": 22,
            "type": [
                "string"
            ]
        },
        "gender": {
            "maxLength": 7,
            "minLength": 4,
            "type": [
                "string"
            ]
        },
        "hha_points": {
            "maxLength": 573,
            "minLength": 0,
            "type": [
                "number"
            ]
        },
        "image_closet": {
            "type": [
                "null"
            ]
        },
        "image_storage": {
            "type": [
                "null"
            ]
        },
        "internal_id": {
            "maxLength": 14986,
            "minLength": 127,
            "type": [
                "number"
            ]
        },
        "is_crafted": {
            "type": [
                "boolean"
            ]
        },
        "is_equipment": {
            "type": [
                "boolean"
            ]
        },
        "is_unlocked": {
            "type": [
                "boolean"
            ]
        },
        "name": {
            "maxLength": 29,
            "minLength": 4,
            "type": [
                "string"
            ]
        },
        "sell_price": {
            "maxLength": 80000,
            "minLength": 10,
            "type": [
                "null",
                "number"
            ]
        },
        "style_1": {
            "maxLength": 8,
            "minLength": 4,
            "type": [
                "string"
            ]
        },
        "style_2": {
            "maxLength": 8,
            "minLength": 4,
            "type": [
                "string"
            ]
        },
        "unique_entry_id": {
            "maxLength": 17,
            "minLength": 17,
            "type": [
                "string"
            ]
        },
        "variant_name": {
            "maxLength": 16,
            "minLength": 3,
            "type": [
                "null",
                "string"
            ]
        },
        "version_added": {
            "maxLength": 6,
            "minLength": 5,
            "type": [
                "string"
            ]
        }
    },
    "required": [
        "style_2",
        "name",
        "style_1",
        "version_added",
        "hha_points",
        "gender",
        "is_equipment",
        "color_1",
        "filename",
        "clothing_group_id",
        "unique_entry_id",
        "color_2",
        "is_unlocked",
        "image_closet",
        "image_storage",
        "is_crafted",
        "internal_id"
    ],
    "title": "ClothingDressUp",
    "type": "object"
}